,URL,Title,Text,Time
4,https://www.moneycontrol.com/news/business/bajaj-finance-bajaj-finserv-strong-earnings-that-justify-stock-rally-2748641.html,How Bajaj Allianz Life Insurance reinvented branch services through Mosambee,"Neha DaveMoneycontrol Research, Bajaj Finance is the best performing stock in the Nifty year to date (YTD). While Nifty gave returns of 5 percent, Bajaj Finance is up by 55 percent YTD, creating a staggering alpha for the investors., In fact, it has been one of the biggest wealth-creating stock growing 73x in last 11 years (generating CAGR or compounded annual returns of 48 percent). The stellar stock performance isn’t a surprise since the lender has an enviable track record of growing its asset book by 42 percent CAGR and profit by 62 percent CAGR over the same period., Given the strong outperformance of the stock, the questions that arises is should investors look at the stock incrementally and can it continue to do well? In our view, yes. The stock is expensive, but for a reason. Investors cannot ignore this business of lending to the aspirational mass, which is in a sweet spot., Quarter at a glance, Bajaj Finance , Bajaj Finance, one of the largest retail asset financing NBFCs in India, posted yet another year of solid net profit growth of 81 percent year -on-year (YoY) as per Ind AS (Indian Accounting Standards) led by robust loan book growth and controlled expenses. The loan book increased to Rs 93,314 crore, growth of 35 percent YoY. Adjusting for one-off short-term IPO financing amount outstanding in Q1 of last year, loan growth would be 39 percent YoY., Loan growth was broad based and was contributed by almost all business segments. Rural segment constitutes 7 percent of the loan book up from 1 percent in 2015 as company has increased rural branches & franchisees to 693, which is just below its urban network of 793 branches., , Cost to income declined to 37 percent from 42 percent last year as the base year had one off cost. Also, moving of housing finance business to a separate subsidiary led to some cost savings. However, cost are expected to inch up again as the lender continues invests for growth.  Asset quality improved with gross non-performing assets at 1.4 percent as compared to 1.7 percent last year. Despite providing as per expected credit loss (ECL) method prescribed in Ind AS, the increase in provisions was limited at 7 percent, indicating the NBFC was already following a conservative provisioning policy. The provision coverage on standard assets improved from 40 bps to 89 bps on transition to Ind-AS., In Q1, the NBFC transitioned to Ind-AS. This resulted in some financial impact as adjustments were done as per norms for the prior-period. The 2 noteworthy impacts are 1) FY17 net worth declined by 6.5 percent and 2) FY18 profits was 7 percent lower under Ind-AS as compared to the reported number as per I-GAAP. While there has been restatement of profit, it is purely an accounting change. It does not alter the underlying economic value of the business or key investment thesis., While the overall operating metric keeps getting better, we are most encouraged by the new customer acquisition of 2.07 million in this quarter, growth of 30 percent YoY. Bajaj Finance now has total franchise of 28.3 million customers., Bajaj Finserv , Bajaj Finserv Limited (BFS), the holding company for the various financial services businesses under the Bajaj group also reported healthy performance. BFS participates in the financing business through its 55 percent holding in Bajaj Finance and in the insurance business through its 74 percent holding in two unlisted subsidiaries, Bajaj Allianz General Insurance Company (BAGIC) and Bajaj Allianz Life Insurance Company (BALIC)., BAGIC: Sharp improvement in combined ratio , BAGIC reported robust Q1 performance with its combined ratio now lowest among the peers. Gross written premium (GWP) increased by 23 percent YoY in Q1 driven by group health which now is the second-largest segment contributing 23 percent to total premium. Motor insurance continues to be largest segment with share of 44 percent of premium while share of crop insurance fell below 2 percent. We are particularly enthused by significant fall in the combined ratio to 90.2 percent, an improvement by 560 bps YoY, leading to underwriting profit., , BALIC: Muted growth, BALIC reported subdued Q1 earnings as growth in individual APE (Annualised Premium Equivalent) was soft at 2 percent YoY. However, a growth of 36 percent in renewal premium helped overall GWP grow at 18 percent YoY. While growth was weak, operating performance improved as persistency ratio increased across all time period (13, 25 and 37 months)., Despite improving performance of insurance businesses, Bajaj Finance (BFL) with 56 percent share, continues to be a significant contributor to parent BFS’s profitability. We like the insurance franchise housed within Bajaj Finserv and see upside to Bajaj Finserv’s valuation driven mainly by lending franchise and well supported by insurance businesses. However, given the fact that holding company structure has certain inefficiencies and awaiting clarity on Allianz’s stake in insurance business, we prefer Bajaj Finance over Bajaj Finserv.,  What will drive Bajaj Finance’s future earnings growth? ,  While there is macro headwind in form of rising interest rates and increasing competition that can compress margins, the micro business of Bajaj Finance continues to be very strong. Consumer durable financing business requires a deep feet-on-street and a considerably evolved risk assessment processes, stringent underwriting norms, agile monitoring and superior collection mechanisms.  With the usage of technology, Bajaj finance has succeeded in creating all of these and build a superior franchise with significant moats., Despite its high growth, Bajaj Finance’s loan book is only 1 percent of the outstanding credit. Hence, we see enough growth potential.  For instance, Bajaj finance’s existing customer franchise of 28 million is estimated to have around Rs 5 to 6.5 trillion of outstanding mortgage loans. Bajaj’s ability to on-board them as its mortgage customers can offer immense growth opportunity. Moreover, there is significant opportunity to cross-sell products.  Overall, we see earnings growth sustainable on the back of Bajaj finance’s vantage positioning and enough growth potential in the segment., The big question for investors: Is the steep valuation justified, the high earnings growth notwithstanding?, Bajaj finance’s stock is up sharply by 29 percent since our last earnings review note in May wherein we suggested investors to buy the stock. It is currently trading at FY20e P/B ratio (price-to-book) of 6.7 which is a significant premium to many other NBFCs., There is little room for a re-rating of the valuation multiple. But we feel the company can maintain high earnings growth trajectory in the near term which will lend support to the premium valuations. Having said that, steep valuation doesn’t leave much room for the lender to falter on growth or on asset quality., While the rich valuations demand caution, the business’s unique moats make it a must own core holding amongst Indian NBFCs. Hence, in the current volatile phase of the market, investors should look out for any price correction opportunity to buy into the stock., Follow @nehadave01, For more research articles, visit our Moneycontrol Research page",no time
5,https://www.moneycontrol.com/news/business/companies/is-consolidationthe-cards-for-insurance-industry-986694.html,Bajaj Finance & Bajaj Finserv: Strong earnings that justify stock rally,"Chaitanya Gudipatymoneycontrol.comIf the fortnight gone by is any indication, two big-ticket deals can mark the beginning of consolidation in the country’s insurance sector. What started as the sector's maiden buyout with Housing Development Finance Corporation (HDFC)-promoted HDFC Ergo general insurance company agreeing to acquire L&T General Insurance for Rs 551 crore on June 3 seems to be paving way for further mergers in the insurance segment.On June 17, the board of three companies — HDFC Standard Life, Max Life and Max Life Insurance — agreed to a merger of their businesses, and announced that they will be conducting due dilligence before they create a separate insurance entity., The deal is set to make HDFC Life the country’s largest private insurance company by individual premium market share. Max Life is expected to be merged with Max Financial Services (MFS) following which MFS will be merged with HDFC Life. The combined entity will be called HDFC Life which, according to industry estimates, could be valued at Rs 50,000 crore., Deepak Parekh, Chairman of HDFC, told CNBC-TV18 that he expects the combined business to be more accretive in terms of profit. Since Max Financial Services is a listed company, Parekh said HDFC will have to give Max a premium for their distribution and quality products. Distributors of insurance products — HDFC Bank, Axis Bank and Yes Bank — will contribute more to the combined entity's growth, he said., Similarly, reports have emerged about a potential buyout of Allianz SE's stake by Bajaj Finserv in two joint ventures — Bajaj Allianz Life Insurance and Bajaj Allianz General Insurance. Industry experts peg the deal at Rs 10,000 crore with total valuation of life and general insurance business expected to be around Rs 40-45,000 crore., Declining to comment on the reports, Sanjiv Bajaj, Managing Director of Bajaj Finserv, told CNBC-TV18 that there is an immense potential for consolidation in the country’s insurance sector. Going ahead, Bajaj Finserv will continue to grow organically and is waiting patiently to build on its life insurance business, Bajaj said. , Both Parekh and Bajaj expect the insurance industry to clock a 10-12 percent growth in FY17.",no time
6,https://www.moneycontrol.com/news/business/stocks/bajaj-finserv8-may-buy-allianzs-stakeinsurance-units-986932.html,Is consolidation on the cards for insurance industry?,"Bajaj Finserv shares touched record high of Rs 2,245.30, up 8 percent intraday Monday after a media report indicated that the company is likely to buy out German partner's stake in its insurance units., ""Bajaj Finserv is likely to buy out its German partner Allianz SE's stakes in two insurance units — Bajaj Allianz Life Insurance and Bajaj Allianz General Insurance — in a deal estimated at as much as Rs 10,000 crore,"" a media report said quoting three people familiar with the development., Bajaj Finserv, the financial services arm of Bajaj Holdings and Investments, owns 74 percent and Allianz SE holds 26 percent in both the ventures., ""Allianz has been in discussions with Bajaj to increase its stake in the two insurance firms to 49 percent after the government raised the foreign investment limit in Indian insurers to 49 percent from 26 percent in March 2015. The discussions failed to yield any result since the two parties could not agree on the price,"" the report says., At 15:02 hours IST, the scrip of Bajaj Finserv was quoting at Rs 2,186.95, up Rs 111.40, or 5.37 percent amid high volumes on Bombay Stock Exchange.",no time
7,https://www.moneycontrol.com/news/business/earnings/bajaj-holdingsinvestment-q4-net-grows-7-to-rs-564-crore-995707.html,"Bajaj Finserv up 8%, may buy Allianz's stake in insurance units","Bajaj Holdings & Investment (BHIL) reported a growth of 7.4 percent in consolidated net profit at Rs 564 crore for the quarter ended March 2016., The company had registered a net profit of Rs 524.9 crore in the January-March quarter of the previous fiscal., BHIL held a strategic stake of 31.5 percent in Bajaj Auto (BAL), 39.3 percent in Bajaj Finserv (BFS) and 24 percent in Maharashtra Scooters (MSL), it said in a regulatory filing., The performance has come on top of Bajaj Finserv's consolidated results that included numbers from lending arm Bajaj Finance (BFL) and two insurance subsidiaries -- Bajaj Allianz Life Insurance (BALIC) and Bajaj Allianz General Insurance Company (BAGIC)., For the entire fiscal, BAL recorded its highest-ever profit after tax (standalone) of Rs 3,652 crore in 2015-16 against Rs 2,814 crore a year ago., BFS (consolidated) too recorded its highest ever net profit of Rs 1,863 crore in the fiscal as against Rs 1,690 crore in 2014-15., ""Accordingly, BHIL's consolidated profit after tax (or net profit) for Q4 2015-16 increased by 7 percent to Rs 564 crore from Rs 525 crore in year-ago period,"" it said., Total income during the January-March quarter increased to Rs 124.8 crore, from Rs 84.8 crore a year earlier., For the full year, the company's net consolidated profit rose by 12 percent to Rs 2,265.2 crore in 2015-16, from Rs 2,029.24 crore in the previous fiscal., Total income, however, decreased to Rs 476.7 crore during the fiscal, from Rs 558.8 crore a year ago., On standalone basis, net profit jumped multi-fold to Rs 556 crore in January-March of 2015-16 from Rs 42 crore a year earlier., ""The company received interim dividends from group companies and other corporates. Both movements in equity markets and decline in interest rates provided an opportunity to the company to realise profit on sale of some of its investments,"" it said., Standalone income increased to Rs 587.1 crore during the quarter ended March, from Rs 82.1 crore in the year-ago period., In full year 2015-16, standalone net profit jumped 46 percent to Rs 1,271 crore, from Rs 868 crore a year earlier., Total income increased to Rs 1,401.3 crore, from Rs 1,006.5 crore., BHIL is an investment company whose focus is on earning income through dividends, interest and profits on investments held. It is largely dependent on the stock and money markets for its income., The board of directors of the company at its meeting held today has recommended a final dividend of Rs 7.50 per equity share (75 percent).",no time
8,https://www.moneycontrol.com/news/business/companies/bajaj-allianz-life-signs-corporate-agency-pactvakrangee-1021292.html,Bajaj Holdings & Investment Q4 net grows 7% to Rs 564 crore,"Bajaj Allianz Life Insurance said it has signed a corporate agency agreement with Vakrangee to distribute its products through the latter's platform., Under the agreement, Bajaj Allianz Life will distribute its various products through more than 23,000 Vakrangee Kendras across the country, the private insurer said., Vakrangee Kendras provides real-time banking, insurance, e-governance, e-commerce and ATM services to unserved rural customers, semi-urban and urban markets.",no time
9,https://www.moneycontrol.com/news/business/personal-finance/budget-2016-will-be-next-stepthe-patheconomic-growthdevelopment-1036075.html,Bajaj Allianz Life signs corporate agency pact with Vakrangee,"Sampath ReddyBajaj Allianz Life InsuranceIndia’s Finance Minister shall be presenting the Annual Budget for FY17 on February 29, 2016. The key theme which has been in debate over the past few weeks is whether the government would continue to follow the revised FRBM (Fiscal Responsibility and Budget Management) targets as set out last year (Fiscal deficit at 3.5% of GDP in FY17 and 3.0% in FY18) or will the government look to extend the target yet again?We think that the Finance minister shall be walking a tight rope to manage the fiscal austerity path. Though the chances of a slippage from the FRBM path are high, owing to 7th pay commission payouts, but these would to a certain extent get offset by higher revenues.Impact of 7th Pay commission and OROP (One Rank one Pension): 7th Pay commission and OROP shall result in additional revenue spending by the government to the extent of about INR 1.1 lac crores ( including spending by Railways of about INR 30k crores). Net of incremental tax revenues, this translates into about 0.5% of GDP. We think that the government would likely defer a part of this payment into FY18 resulting in likely payout of about 0.3% of GDP in FY17. On direct tax front, the government shall go ahead with reduction in the corporate tax rate (from 30% to 29%) along with reductions in some exemptions, which should have a neutralizing effect. The indirect tax collections shall reap the benefits of higher fuel excise duties as well as increase in service tax (2% increase expected). Non tax revenues shall also be higher on account of the telecom auction next year. We think that the finance minister would maintain the fiscal deficit at 3.5% of GDP in FY17. We expect net market borrowing to rise to INR 4.8 trn in FY17 (FY16: INR 4.4 trn) and gross borrowing to increase to INR 6.5 trn in FY17 from INR 5.85 trn in FY16.The biggest worry in this year’s budget is clearly the roadmap for long term capital gains tax (LTCG). In India, equity market linked investments (shares, equity MF units, etc.) are taxed at 0% if the holding period is over one year, 15% if the holding period is less than 1 year.An additional important point to be watched is the spending on infrastructure and defense with the idea of reviving up the stalled economy. The ministry of urban development has mentioned its goal to set up 100 smart cities across the country well distributed across different states. A clear budgetary allocation towards setting up of these smart cities will go a long way towards bringing tangibility to the concept. Financial tangibility to the “Make in India” campaign is also keen watched.The government has recently announced that it intends to encourage the startup culture in India. Announcement of tax incentives towards the same along with the steps to ensure smoother and faster setting up of businesses with minimum red tape is the need of the hour. We expect the budget to act as a starting point towards the same. Most of the public sector banks are reeling under the dual pressure of higher NPA and low capital adequacy, which is resulting in cautious lending. The government is likely to set aside funds for infusion into public sector banks with the idea of shoring up their capital and improving the health of the banking system.The metals industry is reeling under the pressure of low global prices along with pressure from Chinese imports. The domestic steel companies are under extreme levels of stress and we expect announcement of import duties- already done in the form of MIP to safeguard the domestic steel industry. Pollution has proved to be a big worry for Indian cities. We expect the government to announce a “Cash for Clunkers” kind of program, where we expect the government to phase out commercial vehicles which are older than 20 years and announce tax incentives towards purchase of new vehicles in the form of higher deductions.Overall, we expect the government to announce additional steps towards reform which would translate into faster execution of the vision of the PM which would result in India being the fastest growing economy in the globe over the coming few years.",no time
10,https://www.moneycontrol.com/news/business/companies/bajaj-allianz-eases-claim-norm-for-quake-victims-1507841.html,Budget 2016: Will be next step on the path of economic growth & development,"Bajaj Allianz Life Insurance today said it has simplified its claim settlement norms for the victims of devastating earthquake in Nepal and northern and eastern parts of India., ""In the massive earthquake in Nepal, Indian states of Uttar Pradesh, Bihar, West Bengal, Assam, Sikkim, Delhi, NCR, Uttarakhand, Rajasthan and Jharkhand many lost their near and dear ones and some are still missing,"" a company release said.  for claim applications for the earthquake victims., While the requirement for documents has been already minimised, procedure for investigation conducted by the insurer may be waived if prima-facie documents establish the life assured's death is due to earthquake, it added., The company would make the best efforts to settle a majority of the claims coming out of this natural disaster within 72 hours., Wherever death certificate issued by registrar of births and deaths is not available, the insurer will accept the certified list (Government Gazette copy) having name of life assured issued by either of government hospitals or police or government authorities of Nepal and states of India or armed forces involved in rescue operations., Other rider benefits (except accidental death benefit) shall be processed on the basis of hospital records of treatment post disaster for accidental disability and other rider benefits. Accidental death benefit shall be considered along with claim for death benefit, the release added., In case of missing persons, presumption of death shall be on the basis of the list provided, as and when, by the Government of Nepal/Government of India or the respective state governments on missing persons and the requirement of seven years waiting period shall not be insisted upon., However, when contacted by PTI, Bajaj Allianz Life Insurance senior manager (claims) Nandam Raju said, ""We have not received any claims from the quake-affected areas so far. The claim settlement process will begin only once we receive any claims."", The company has also set up a dedicated team to assist the earthquake affected people in faster claim settlement. ",no time
11,https://www.moneycontrol.com/news/business/personal-finance/objective-is-to-earn-good-returnlower-risk-reddy-1197911.html,Bajaj Allianz eases claim norm for quake victims,"One should look to buy stocks when prices decline and should be willing to buy more, feels Sampath Reddy, CIO – Bajaj Allianz Life Insurance., Q: What is your philosophy towards investment?, Investment philosophy is towards maximising risk adjusted returns over a long period of time. Focus would be on research driven investment decision based on detailed fundamental research comprising of thorough due diligence of the financials of a company., Q: Are you disciplined when it comes to investments?, A: Yes, Q: What kind of an investor would you describe yourself as: conservative, balanced or aggressive?, A: I would describe myself as a balanced investor on the whole. The objective is to earn a reasonable return with lower risk., Q: Which is your most preferred instrument for investment?, A: A carefully-picked portfolio of equity investments would be a good option. Also, tax free bonds offer attractive long term returns for investors in the high tax bracket., Q: Could you share some of your experiences in investing?, A: One should look to buy stocks, where if the price declines, one should be willing to buy more. One can do that only if he understands the business and its management thoroughly and its valuations. If one does not have this level of conviction, usually one would end up loosing in stock market, due to the inherent volatility in the stock market. You will sit tight and/or buy more to ride the upsides only if one is thoroughly convinced about the future prospects of the company., Q: What is your advice to the general public as far as investing is concerned?, A: Investors should have portfolio approach- combination of instruments that could give a steady fixed income to meet near term goals and also offer long-term capital appreciation. Within the equities one can further dived the portfolio in to a combination of midcap growth stocks and as well as a portfolio of large established companies.",no time
12,https://www.moneycontrol.com/news/business/markets/better-times-ahead-for-indian-equity-markets-1411107.html,Objective is to earn good return with lower risk: Reddy,Brokerage house UBS has upgraded China to ‘overweight’. But its stand on India is ‘neutral’. Should Indian investors stay invested in India or buy a feeder fund into China? Pravin Palande asks experts,no time
13,https://www.moneycontrol.com/news/business/companies/-1326207.html,Better times ahead for Indian equity markets,V PhilipBajaj Allianz Life Insurance,no time
14,https://www.moneycontrol.com/news/business/mutual-funds/-1191229.html,Budget 2013-14: Is FM listening to what insurance companies want?,Insurance sector watchdog IRDA today has imposed a fine of Rs 5 lakh on Bajaj Allianz Life Insurance for violating  regulations pertaining to group unit-linked policies.,no time
15,https://www.moneycontrol.com/news/business/companies/-1231063.html,IRDA slaps Rs 5-lakh fine on Bajaj Allianz Life,Private insurer Bajaj Allianz Life Insurance today launched a new unit-linked plan,no time
16,https://www.moneycontrol.com/news/business/personal-finance/-1174805.html,Bajaj Allianz Life launches GMIP under ULIP portfolio,"In an interview with CNBC-TV18, Subhash Lakhotia, Tax Guru; Sanjay Sinha, CEO of L&T Mutual Fund and Kamesh Goyal, Country Head of Bajaj Allianz Life Insurance evaluate the Union Budget and its impact on your wallet. ",no time
