,URL,Title,Text,Time
0,https://www.moneycontrol.com/news/health-and-fitness/storyboard18-x-just-sports-marathon-musings-of-a-marketer-8609061.html,ICICI Prudential Life Insurance Q3 profit flat at Rs 302 crore,"As a child, I could not complete 200 meters in school during the pre-Sports’ Day audition. I am a beginner, having run marathons for the last 15 years across different cities around the world including New York, Berlin, Mumbai, Boston, Chicago, London, Amsterdam, and Delhi. Over the years my Personal Best (PB) finish time improved from 4:42 to 3:33 (Hour: Minutes). And a PB of half marathon at sub-100 minutes. I have gone through terrible long-lasting injuries and some epic failures. The last marathon, at Rotterdam in April 2022, I “Did Not Finish”. This is the second time I Did Not Finish a marathon race., The injuries and failures have taught me as much as my PBs. I draw learnings from every marathon experience which could be relevant to my career, business, and life in general., You are what you do repeatedly: Primarily, it’s training, however boring it sounds, which will see you through the finishing line. Organisational capabilities are built and competitive advantages are sustained by doing those essential activities repeatedly. It is still the good-old-fashioned hard work and discipline that will help you endure business uncertainties and tough times. Like following a 5-day-a-week running regime, starting at 5.00 am, there is no escape from rolling up your sleeves and getting your hands dirty again and again., Speed can kill your run, business, and career: Starting the run faster or trying to outpace a faster co-runner can lead to hitting the wall soon during the race or to poor finish timing. Similarly, an indiscreet move like accelerated expansion or enthusiastic spending on promotion, or exorbitant investments in fancy technology is a sure-short recipe to value erosion, delayed profitability, or employee attrition, due to fatigue and low morale, in the middle of the battle., Respect and adapt to changing conditions: Varying race courses or weather conditions are akin to dynamic regulations, changing consumer behavior, the onslaught of technology or local market conditions. A good run at the Amsterdam Marathon does not translate into a good one at the Mumbai Marathon and vice versa. Like for business markets, a successful stint in your last job may not necessarily be the same in your new job. Respect and adapt to different organisational cultures, norms, and protocols. What got you there, may not get you here., Prepare for Uphill but restrain during Downhill: Though as much as I hate uphills during the run, downhills have been the causes of my serious marathon injuries – at times kept me off running for several weeks, and months. Exuberance emanating from the perceived economic boom or a short-term spike in sales is typically followed by over-leverage or undesirable sales practices. Be mindful of the consequences of the increased risk-taking capacity and actions in good times or rather, perceived good times., Cramps are inevitable - Keep going: However hard you train, you are bound to experience cramps or severe aches during the marathon race. Many runners will agree that sooner or later they auto disappear or, at least, the pain intensity reduces. Similarly, both in career and business short-term blips are certain. Do not let a tough quarter or hostile conditions at work bog you down. As they say, this too shall pass., Rapid change is lethal: Many marathon beginners make the mistake of changing their running gear or their diet during race day which leads to sub-optimal race performance. Similarly, an abrupt and rapid change in strategy during a penultimate business period could be disastrous as it takes time for the entire organizational machinery including the sales force and operations team to adapt and synchronise the action. That is why many changes that look promising in the boardroom, fail to take off because the ecosystem was inadequately prepared for rapid change., Micro breaks are important even before you need them: Staying hydrated through the run will keep you going. Many seasoned runners know the importance of drinking water or sports drinks at a regular interval; in fact, doing so much ahead of getting into the red zone. Plan your breaks well in advance even before you need them. It will keep you energized through the journey., Know when to Quit: We have been brought up worshiping “Grit”. Being wise to timely quit can cut deep losses and keep you afloat. It was frustrating to quit the Rotterdam race at the 32 K mark, due to unbearable recurring pain. Had I continued, it is probable that my injury would have worsened to force me out of running permanently., Mental Fatigue overpowers physical strength: With exactly the same fitness level, a runner with mental fatigue or perception of exhaustion is slower than his peer who is comparatively mentally fresh. Leaders could curb mental fatigue by creating a fair and conducive work environment. Individuals could keep themselves rejuvenated by following passions outside work, traveling, music, reading, regular exercises etc., To run far, run together: As surprising as it may sound, running a marathon is a team sport. Eventually, being surrounded by the right co runners, family, friends, coach, physios, nutritionist, etc. gets you to the finishing line. Exactly the same in Business and Careers. Supportive workmates, family, friends, and mentors will unlock the best version of you. If you need to run fast, run alone. If you want to run far, run together., Note to readers: Storyboard18’s new Month In Focus initiative spotlights themes and topics that are pushing marketers to reshape and rethink how brands interact with today’s customers. Our first theme is Just Sports, a special spotlight on sports marketing presented by Sports18. We bring to you stories of how marketers are harnessing the power of technology, innovation and creativity in sports to create powerful storytelling in campaigns that increase affinity and loyalty with audiences. From traditional sports platforms around cricket to emerging games and the rise of esports, we get leading voices from the marketing and sports worlds to give us sharp and fast insights into future-facing marketing practices. Also, tune in for analyses which will surface ideas and strategies that are helping brands to level up experiences and storytelling with authentic collaborations. So watch this space for Just Sports.",no time
1,https://www.moneycontrol.com/news/business/bajaj-allianz-life-declares-cash-bonus-to-policyholders-for-fy20-5344301.html,Storyboard18 x Just Sports | Marathon Musings Of A Marketer,"Private sector Bajaj Allianz Life Insurance has declared bonus in its participating plans, including payment of cash bonus as on March 31 at a time when businesses are facing a liquidity crunch due to the impact of coronavirus pandemic., The insurer has declared reversionary, cash and terminal bonus for 2019-20, which is expected to benefit 12 lakh policyholders who have stayed invested and entrusted their faith in the company, Bajaj Allianz Life Insurance said in a statement., ""This additional financial support through cash bonus (payable only where it is applicable), we are sure, will enable several of our customers meet some of their immediate financial requirements, or plan for their life goals ahead,"" it said., The bonus rates announced by Bajaj Allianz Life apply to all 19 of its participating plans.",no time
2,https://www.moneycontrol.com/news/business/companies/coronavirus-pandemic-in-a-feet-on-street-industry-heres-how-bajaj-allianz-life-insurance-has-shifted-to-virtual-sales-5154221.html,Bajaj Allianz Life declares cash bonus to policyholders for FY20,"When the March 24 lockdown was announced in India, the insurance sector was worried. The concerns stemmed from the fact that agents won't be able to commute to distribute policies., Bajaj Allianz Life Insurance was also worried, but the fifth-largest private life insurer in the country was prepared to tackle this unprecedented situation., In an interaction with Moneycontrol, Tarun Chugh, MD & CEO, Bajaj Allianz Life Insurance, said considering that the pandemic had affected several parts of the globe, the company was better prepared.,  Tarun Chugh, MD & CEO, Bajaj Allianz Life Insurance, ""While we had a business continuity plan, this is something very different. But we were agile and were able to get up and running soon,” he said., COVID-19 Vaccine, Frequently Asked Questions, A vaccine works by mimicking a natural infection. A vaccine not only induces immune response to protect people from any future COVID-19 infection, but also helps quickly build herd immunity to put an end to the pandemic. Herd immunity occurs when a sufficient percentage of a population becomes immune to a disease, making the spread of disease from person to person unlikely. The good news is that SARS-CoV-2 virus has been fairly stable, which increases the viability of a vaccine., There are broadly four types of vaccine — one, a vaccine based on the whole virus (this could be either inactivated, or an attenuated [weakened] virus vaccine); two, a non-replicating viral vector vaccine that uses a benign virus as vector that carries the antigen of SARS-CoV; three, nucleic-acid vaccines that have genetic material like DNA and RNA of antigens like spike protein given to a person, helping  human cells decode genetic material and produce the vaccine; and four, protein subunit vaccine wherein the recombinant proteins of SARS-COV-2 along with an adjuvant (booster) is given as a vaccine., Vaccine development is a long, complex process. Unlike drugs that are given to people with a diseased, vaccines are given to healthy people and also vulnerable sections such as children, pregnant women and the elderly. So rigorous tests are compulsory. History says that the fastest time it took to develop a vaccine is five years, but it usually takes double or sometimes triple that time., The insurer is a joint venture between Bajaj Finserv and global asset manager and insurer Allianz SE., For the April to February period (FY20), Bajaj Allianz Life collected first year premium of Rs 4593.36 crore, showing a 22.8 percent year-on-year growth., Talking about the business prospects, Chugh said it is difficult to predict impact of COVID-19 on the sector., Also Read: Live updates on Coronavirus outbreak in India, ""Everybody (in the insurance sector) is going to work on three scenario basis, best case, worst case and realistic case. It will take time to get back to normal. Whether it is July, September or January we don’t really know,"" he said., The distribution challenge, For the life insurance industry, agency is the major source of distribution. These individuals are the feet-on-street who visit clients and sell insurance products. But insurers have been forced to suspend face-to-face sales., ""The last 15 days of March accounts for almost 12 percent of the life insurance industry’s annual business. We realized that the entire distribution has to work differently and things need to be virtual (or aided virtual) and video-centric,"" he added., , Chugh explained that the company now has something called a daily choreography where employees are given training on how to divide their day and how to pitch to customers over call., “Insurance has a lot to do about personal connect. Hence, the company invested in an entire rehaul of the training infrastructure. Sales staff is being trained on how to pitch differently, how to strike a conversation over call and how to have a more empathetic discussion with customers,” he added., How is employee management being done?, There is a lot of uncertainty in the market about the future of employment since there is no clear direction about how COVID-19 will pan out and how long it will take to be eradicated., However, Bajaj Allianz Life is clear that it will stay invested in all of its 10,000 employees in the company., “Normally this is a time of the year when the churn happens in the staff strength. But we are going to retrain employees who are on performance improvement processes. Not a single employee will be  fired,” added Chugh. The company also paid salaries five days in advance in March 2020 (on March 25) to all its employees., Despite the lockdown, since insurance is classified as an essential service, all services are up and running., Out of its 10,000 staff, about three to five of Bajaj Allianz Life’s employees are required to go to office to handle the servers. These employees have special passes and travel to switch on/off the devices and servers., How are customers being handled?, Policy sales continues to happen online across life insurance companies. The only difference is that customers do not need to interact through any intermediary., Chugh explained that medical examination done before policy sales has now gone virtual. The idea, he said, is to waive lengthy underwriting processes., ""We have trained employees to medical underwriting using video. Customers talk directly to the underwriter and is willing to disclose a lot more. However, those will pre-existing ailments will need proper physical medical tests done which may not be possible right now,"" he added., There is also a perception that considering the mortality rate under COVID-19, more Indians will realise the need to have a basic life insurance cover., Chugh said that while there may not be an immediate demand, in the medium to long term, individuals will realise the need to buy a risk cover., “The shift will be towards guarantee-based products. How soon? We will have to wait and watch,” he added., In Charts | Economic impact of lockdown on Centre and states, Traditionally, the June quarter is a slow period for the life insurance sector. More than half the annual sales is done in the second of a fiscal. Even if the lockdown is lifted on May 3, industry officials expect revival in business to take another three to four months from that date., Follow our full coverage of the coronavirus pandemic here.",no time
3,https://www.moneycontrol.com/news/technology/how-bajaj-allianz-life-insurance-reinvented-branch-services-through-mosambee-4221281.html,"Coronavirus impact | In a feet-on-street industry, here's how Bajaj Allianz Life Insurance has shifted to virtual sales","Digitization has disrupted every aspect of the insurance sector today, where everything is now just a click away. With customers increasingly seeking customized and instant services, it has become important for banks and insurance services companies to address their needs by adapting to digital transformation and to improve the customer experience., Bajaj Allianz Life Insurance is one such company which has been aggressive in taking leaps in digital transformation using modern technology to overcome technological challenges. It has become the first life insurance player in India to take virtual branch services to the customer’s doorstep through Mosambee, a virtual branch on a handheld device., Mosambee, a disruptive idea, Bajaj Allianz Life continues to keep customers’ life goals at the center of everything they do. The Company introduced the virtual branch services platform Mosambee to offer greater convenience to customers, by eliminating the need for customers to visit a physical branch and reducing the turnaround time in policy servicing., With digitization taking over every aspect of the customer’s life, physically visiting a branch for simple service tasks was being viewed as redundant. Hence the company felt the need for a disruptive innovation to provide customers a seamless service experience at their preferred time and location., Better customer experience and reach, Launched in November 2017, Mosambee offers the services of a virtual branch to the customers at their doorstep. Through Mosambee, customers can avail an entire range of services such as obtaining premium payment certificates, procuring account statements, paying insurance renewal premiums, checking claim status, locating branches, SMS services for updating contact details, obtaining fund value, account statement, bonus statement, claim status, and many more service-related queries. Customers can also pay their renewal premium via Mosambee through cheque, DD, credit and debit cards and other online payment modes., This digital capability has helped Bajaj Allianz Life Insurance eliminate the need for customers to visit a physical branch for simple service requirements. It has empowered them with the flexibility to service their policy requirements at their convenient time and location, thus utilising their time better., Through Mosambee, Bajaj Allianz Life has also been able to enhance its customer reach. Using analytics, the company has identified and tagged locations of customers where the company isn’t present through its branches. This has helped them record customers’ addresses and service them at their doorstep. The company is also better placed to identify suspicious cases during such home visits., Mosambee has helped Bajaj Allianz Life build a long-term relationship with its valued customers and enhance their experience with the company., “Customers are seeking more and more personalized and instant services hence it is important for us to be agile and innovative in addressing the customer’s needs. Our adaption of digital technologies in providing customers seamless services is helping us enhance the customer’s experience with us, and also in building long-term relationship with the customers in their journey to fulfil their Life Goals with us. Mosambee is one such initiative taken by us to provide greater convenience to customers, by making branch services accessible to them at their convenient time and location,” says Kayzad Hiramanek, Chief - Operations & Customer Experience, Bajaj Allianz Life Insurance., Stepping outside the comfort zone, Using analytics and geo location, Bajaj Allianz Life Insurance identified approximately two lakh households in an area of 15 km around its branches, where a branch person could proactively go and offer services to the customer at his doorstep. Mosambee enables the branch person to do everything on the field which he would otherwise do sitting in the branch., The foremost complaint of any insurance customer was that the insurance agent would sell the product and disappear and appear only to collect premiums., To address this, Bajaj Allianz Life pushed its local branch employee, to go out proactively and service the customers at their doorstep. This has especially helped the senior citizens. Through Mosambee, customers can update the address, nominee name, buy new policy, get premium notices, make payment and get receipts – typically what all he could at the branch can now be done online at his doorstep. Today, the branch is no longer sitting in one location, but spread across the location with the bank’s representative servicing the customer wherever he is., Business of Innovation, Since its launch in November 2017, Mosambee’s usage has increased over the years, at around 900 users today. Through this digital touchpoint, Bajaj Allianz Life has been able to reach out to many more customers, thereby improving the persistency ratio of the company. So far, the company has serviced over 150,000 customers through Mosambee and collected renewal premiums amounting to more than Rs. 700 crore, in addition to helping customers with other policy servicing features.",no time
